{
  "schemaVersion": 8,
  "tool": "matlatl",
  "generatedNote": "Generated by matlatl. Machine-readable analysis of a markdown corpus: nodes are documents (importance via hubScore/authorityScore/inDegree), edges are resolved navigational links (type reference) and unlinked mentions (type mention, with kind and line), and orphans/unreachable/brokenLinks/gaps flag what is INCOMPLETE.",
  "summary": {
    "documents": 18,
    "sections": 29,
    "edges": 21,
    "mentions": 0,
    "references": 31,
    "components": 6,
    "orphans": 2,
    "unreachable": 9,
    "underLinked": 8,
    "deadEnd": 1,
    "farFromRoot": 0,
    "brokenLinks": 3,
    "brokenAnchors": 1,
    "ambiguous": 1,
    "knowledgeGaps": 3,
    "suggestedLinks": 1,
    "articulationPoints": 4,
    "bridges": 6,
    "navigability": {
      "compactness": 0.119185,
      "stratum": 0.493827,
      "characteristicPathLength": 2.000000,
      "medianPathLength": 2.000000,
      "clusteringCoefficient": 0.648148,
      "diameter": 4,
      "reachablePairs": 86
    }
  },
  "nodes": [
    {
      "id": "CHANGELOG.md",
      "kind": "doc",
      "title": "Changelog",
      "path": "CHANGELOG.md",
      "description": "Changelog",
      "category": "(root)",
      "inDegree": 0,
      "outDegree": 0,
      "component": "CHANGELOG.md",
      "hubScore": 0.000000,
      "authorityScore": 0.000000,
      "reachable": false,
      "orphan": false,
      "intentionalOrphan": true,
      "underLinked": false,
      "deadEnd": false,
      "bowtie": "disconnected",
      "betweenness": 0.000000,
      "isArticulation": false,
      "pageRank": 0.013302,
      "hopsFromRoot": -1
    },
    {
      "id": "README.md",
      "kind": "doc",
      "title": "Project Home",
      "path": "README.md",
      "description": "Top-level readme for the fixture corpus.",
      "category": "(root)",
      "inDegree": 3,
      "outDegree": 2,
      "component": "README.md",
      "hubScore": 0.470559,
      "authorityScore": 0.477897,
      "reachable": true,
      "orphan": false,
      "intentionalOrphan": false,
      "underLinked": false,
      "deadEnd": false,
      "bowtie": "core",
      "betweenness": 0.014706,
      "isArticulation": true,
      "pageRank": 0.068324,
      "hopsFromRoot": 0
    },
    {
      "id": "docs/README.md",
      "kind": "doc",
      "title": "Docs Index",
      "path": "docs/README.md",
      "description": "Docs Index",
      "category": "docs",
      "inDegree": 0,
      "outDegree": 1,
      "component": "README.md",
      "hubScore": 0.245005,
      "authorityScore": 0.000000,
      "reachable": true,
      "orphan": false,
      "intentionalOrphan": false,
      "underLinked": false,
      "deadEnd": false,
      "bowtie": "in",
      "betweenness": 0.000000,
      "isArticulation": false,
      "pageRank": 0.013302,
      "hopsFromRoot": 0
    },
    {
      "id": "docs/cycle/alpha.md",
      "kind": "doc",
      "title": "Cycle Alpha",
      "path": "docs/cycle/alpha.md",
      "description": "Cycle Alpha",
      "category": "docs/cycle",
      "inDegree": 1,
      "outDegree": 1,
      "component": "docs/cycle/alpha.md",
      "hubScore": 0.000000,
      "authorityScore": 0.000000,
      "reachable": false,
      "orphan": false,
      "intentionalOrphan": false,
      "underLinked": true,
      "deadEnd": false,
      "bowtie": "disconnected",
      "betweenness": 0.000000,
      "isArticulation": false,
      "pageRank": 0.088671,
      "hopsFromRoot": -1
    },
    {
      "id": "docs/cycle/beta.md",
      "kind": "doc",
      "title": "Cycle Beta",
      "path": "docs/cycle/beta.md",
      "description": "Cycle Beta",
      "category": "docs/cycle",
      "inDegree": 1,
      "outDegree": 1,
      "component": "docs/cycle/alpha.md",
      "hubScore": 0.000000,
      "authorityScore": 0.000000,
      "reachable": false,
      "orphan": false,
      "intentionalOrphan": false,
      "underLinked": true,
      "deadEnd": false,
      "bowtie": "disconnected",
      "betweenness": 0.000000,
      "isArticulation": false,
      "pageRank": 0.088671,
      "hopsFromRoot": -1
    },
    {
      "id": "docs/flow/aside.md",
      "kind": "doc",
      "title": "Tendril Aside",
      "path": "docs/flow/aside.md",
      "description": "Tendril Aside",
      "category": "docs/flow",
      "inDegree": 0,
      "outDegree": 1,
      "component": "README.md",
      "hubScore": 0.051067,
      "authorityScore": 0.000000,
      "reachable": false,
      "orphan": false,
      "intentionalOrphan": false,
      "underLinked": true,
      "deadEnd": false,
      "bowtie": "tendril",
      "betweenness": 0.000000,
      "isArticulation": false,
      "pageRank": 0.013302,
      "hopsFromRoot": -1
    },
    {
      "id": "docs/flow/branch.md",
      "kind": "doc",
      "title": "Downstream Branch",
      "path": "docs/flow/branch.md",
      "description": "Downstream Branch",
      "category": "docs/flow",
      "inDegree": 2,
      "outDegree": 1,
      "component": "README.md",
      "hubScore": 0.000000,
      "authorityScore": 0.133143,
      "reachable": true,
      "orphan": false,
      "intentionalOrphan": false,
      "underLinked": true,
      "deadEnd": false,
      "bowtie": "out",
      "betweenness": 0.025735,
      "isArticulation": true,
      "pageRank": 0.061183,
      "hopsFromRoot": 2
    },
    {
      "id": "docs/flow/terminal.md",
      "kind": "doc",
      "title": "Terminal Page",
      "path": "docs/flow/terminal.md",
      "description": "Terminal Page",
      "category": "docs/flow",
      "inDegree": 1,
      "outDegree": 0,
      "component": "README.md",
      "hubScore": 0.000000,
      "authorityScore": 0.000000,
      "reachable": true,
      "orphan": false,
      "intentionalOrphan": false,
      "underLinked": false,
      "deadEnd": true,
      "bowtie": "out",
      "betweenness": 0.000000,
      "isArticulation": false,
      "pageRank": 0.065308,
      "hopsFromRoot": 3
    },
    {
      "id": "docs/guide.md",
      "kind": "doc",
      "title": "User Guide",
      "path": "docs/guide.md",
      "description": "How to use the thing.",
      "category": "docs",
      "inDegree": 4,
      "outDegree": 2,
      "component": "README.md",
      "hubScore": 0.408849,
      "authorityScore": 0.638791,
      "reachable": true,
      "orphan": false,
      "intentionalOrphan": false,
      "underLinked": false,
      "deadEnd": false,
      "bowtie": "core",
      "betweenness": 0.018382,
      "isArticulation": true,
      "pageRank": 0.093990,
      "hopsFromRoot": 1
    },
    {
      "id": "docs/island/four.md",
      "kind": "doc",
      "title": "Island Four",
      "path": "docs/island/four.md",
      "description": "Island Four",
      "category": "docs/island",
      "inDegree": 0,
      "outDegree": 2,
      "component": "docs/island/four.md",
      "hubScore": 0.000000,
      "authorityScore": 0.000000,
      "reachable": false,
      "orphan": false,
      "intentionalOrphan": false,
      "underLinked": true,
      "deadEnd": false,
      "bowtie": "disconnected",
      "betweenness": 0.000000,
      "isArticulation": false,
      "pageRank": 0.013302,
      "hopsFromRoot": -1
    },
    {
      "id": "docs/island/one.md",
      "kind": "doc",
      "title": "Island One",
      "path": "docs/island/one.md",
      "description": "Island One",
      "category": "docs/island",
      "inDegree": 3,
      "outDegree": 1,
      "component": "docs/island/four.md",
      "hubScore": 0.000000,
      "authorityScore": 0.000000,
      "reachable": false,
      "orphan": false,
      "intentionalOrphan": false,
      "underLinked": false,
      "deadEnd": false,
      "bowtie": "disconnected",
      "betweenness": 0.000000,
      "isArticulation": false,
      "pageRank": 0.164040,
      "hopsFromRoot": -1
    },
    {
      "id": "docs/island/three.md",
      "kind": "doc",
      "title": "Island Three",
      "path": "docs/island/three.md",
      "description": "Island Three",
      "category": "docs/island",
      "inDegree": 0,
      "outDegree": 2,
      "component": "docs/island/four.md",
      "hubScore": 0.000000,
      "authorityScore": 0.000000,
      "reachable": false,
      "orphan": false,
      "intentionalOrphan": false,
      "underLinked": true,
      "deadEnd": false,
      "bowtie": "disconnected",
      "betweenness": 0.000000,
      "isArticulation": false,
      "pageRank": 0.013302,
      "hopsFromRoot": -1
    },
    {
      "id": "docs/island/two.md",
      "kind": "doc",
      "title": "Island Two",
      "path": "docs/island/two.md",
      "description": "Island Two",
      "category": "docs/island",
      "inDegree": 3,
      "outDegree": 1,
      "component": "docs/island/four.md",
      "hubScore": 0.000000,
      "authorityScore": 0.000000,
      "reachable": false,
      "orphan": false,
      "intentionalOrphan": false,
      "underLinked": false,
      "deadEnd": false,
      "bowtie": "disconnected",
      "betweenness": 0.000000,
      "isArticulation": false,
      "pageRank": 0.164040,
      "hopsFromRoot": -1
    },
    {
      "id": "docs/links.md",
      "kind": "doc",
      "title": "Link Showcase",
      "path": "docs/links.md",
      "description": "Link Showcase",
      "category": "docs",
      "inDegree": 0,
      "outDegree": 3,
      "component": "README.md",
      "hubScore": 0.653854,
      "authorityScore": 0.000000,
      "reachable": false,
      "orphan": false,
      "intentionalOrphan": false,
      "underLinked": true,
      "deadEnd": false,
      "bowtie": "in",
      "betweenness": 0.000000,
      "isArticulation": false,
      "pageRank": 0.013302,
      "hopsFromRoot": -1
    },
    {
      "id": "docs/project/notes.md",
      "kind": "doc",
      "title": "Project Notes",
      "path": "docs/project/notes.md",
      "description": "Project Notes",
      "category": "docs/project",
      "inDegree": 0,
      "outDegree": 0,